author,created_utc,edited,id,num_comments,over_18,score,spoiler,stickied,title,url,sentiment_score,sentiment_label,emoji_sentiment
paul70,2024-07-05 23:08:37,True,ofjhJtSg,42,False,70,False,False,At hair direction learn world.,https://rosales.info/,0.0,neutral,neutral
whitehannah,2024-01-18 18:42:01,True,mkxcCgoB,50,False,74,False,True,So concern require Democrat arm two evening. 😡 🤬,http://www.brooks.com/,0.0,neutral,negative
rodriguezanthony,2024-11-11 14:45:43,True,iqWXGaYh,26,True,88,False,True,Discuss purpose catch as build always fall.,http://hobbs.info/,0.0,neutral,neutral
anthony07,2024-06-11 14:11:39,True,JJVZNfMA,8,True,32,False,True,Which impact side.,https://www.white-taylor.com/,0.0,neutral,neutral
juliehooper,2024-01-28 21:42:35,False,FVPvfnge,3,True,59,False,True,Southern tree child personal from great project.,https://www.thompson.biz/,0.26666668,positive,neutral
nphillips,2024-09-11 10:33:54,True,woEwuNti,17,True,95,True,True,Star can certain professor cut bill.,http://robinson.com/,0.21428572,positive,neutral
daniel79,2024-07-07 19:54:01,False,zYUAouSu,42,True,82,False,True,Carry detail sure control no. 💀 😭 💔,http://www.smith.info/,0.5,positive,negative
williamsjeremy,2024-05-29 17:25:47,False,CiEtyqVs,15,False,90,True,False,Beyond great answer general pretty cup single.,https://www.evans.com/,0.25714287,positive,neutral
bgarrett,2024-10-12 07:49:49,False,GgzjjdaC,39,False,72,True,True,Wish writer fly recently can.,http://www.stevens.com/,0.4,positive,neutral
vaughnshirley,2024-09-15 05:08:39,False,YuUDPmFK,16,True,20,True,False,Positive man agency indicate really.,http://jones.biz/,0.21363637,positive,neutral
