author,created_utc,edited,id,num_comments,over_18,score,spoiler,stickied,title,url,sentiment_score,sentiment_label,emoji_sentiment
nicholasleblanc,2024-08-08 11:08:48,True,jYkErsxb,36,True,82,True,True,Fact tree already market scene especially.,https://www.davis.info/,0.0,neutral,neutral
qturner,2024-01-25 06:54:05,False,hBLNUMxv,25,True,34,False,False,Sometimes fall respond loss film maintain American.,http://khan-shaffer.com/,0.0,neutral,neutral
douglas84,2024-10-13 05:39:55,True,zyOSvJIw,38,False,16,True,True,Pressure because cut public protect. 😭 👎,https://allen-oconnor.net/,0.0,neutral,negative
johnharmon,2024-09-18 05:04:00,True,CgtvHEnt,10,False,20,False,False,Until support movie thousand.,https://mckee.com/,0.0,neutral,neutral
justinnixon,2024-05-26 08:50:36,True,lNQQAbDR,8,False,80,True,True,Different language impact despite.,https://colon.biz/,0.0,neutral,neutral
westbrian,2024-10-24 07:32:38,True,ZvkAJQyS,1,False,41,True,False,Determine commercial second information.,http://www.stein.biz/,0.0,neutral,neutral
villajohn,2024-08-21 17:52:45,False,OQKCtvSO,41,False,76,True,False,Address miss hand government.,http://johnson.org/,0.0,neutral,neutral
davisandrew,2024-07-16 14:04:24,False,zFiABvUO,42,False,72,False,True,Carry manager avoid design finish pass.,http://baker-kennedy.biz/,0.0,neutral,neutral
mary46,2024-07-05 14:11:59,True,uvgpJtOh,12,True,55,False,True,Bar machine decide travel American involve.,http://www.terry-smith.com/,0.0,neutral,neutral
brooke96,2024-09-10 18:49:28,True,cWBcyyZP,39,False,18,True,True,None morning final do necessary management image but. 💡 🌟 📚,https://drake.com/,0.0,neutral,neutral
