author,created_utc,edited,id,num_comments,over_18,score,spoiler,stickied,title,url,sentiment_score,sentiment_label,emoji_sentiment
kaufmanlisa,2024-09-11 11:22:31,False,xKShjAFj,41,True,49,False,False,South theory project leader cup realize member.,https://goodwin-lee.com/,0.0,neutral,neutral
jmccall,2024-09-27 05:21:02,True,TWYOWueA,24,True,27,False,False,Participant everybody age hand young compare pick.,https://www.sullivan-rios.com/,0.1,positive,neutral
gloriatorres,2024-09-17 20:33:42,True,jqIMxEHP,10,False,35,False,False,Be suddenly these cut.,https://solomon.net/,0.0,neutral,neutral
amyhall,2024-04-14 05:27:41,False,vBTGbpcq,5,False,72,True,False,Reason hard finish check room.,https://www.dyer-sharp.com/,-0.29166666,negative,neutral
gabrielahogan,2024-03-09 02:31:29,True,PUnInqlW,50,False,45,True,True,Within approach usually throughout.,http://www.mccoy-hernandez.com/,-0.25,negative,neutral
janice59,2024-08-12 09:05:04,True,mvLNwbHw,16,False,23,True,True,Assume spring throughout trial discussion official thousand.,https://www.lawson.com/,0.0,neutral,neutral
micheleburns,2024-04-20 00:26:39,False,bVKfvgbs,44,False,72,False,False,While source fire.,https://www.graves-dawson.com/,0.0,neutral,neutral
cchang,2024-05-26 05:40:16,True,mibFvyks,40,True,75,True,False,Yeah claim build factor attack.,http://ross-hall.com/,0.0,neutral,neutral
kimberlydavis,2024-01-31 02:30:00,True,zOGhNLGj,39,False,59,False,True,Again speech it thing.,http://myers.biz/,0.0,neutral,neutral
jesus34,2024-03-19 21:26:06,True,MoYDtKpi,25,True,82,True,False,Choice push wide wear church ability hour.,http://www.greene.com/,-0.1,negative,neutral
