author,created_utc,edited,id,num_comments,over_18,score,spoiler,stickied,title,url,sentiment_score,sentiment_label,emoji_sentiment
heather85,2024-09-27 10:38:27,True,EaYMwLMy,34,True,35,False,False,Radio team strong late factor hotel as. 🌟,https://www.robinson.com/,0.06666667,positive,positive
sharonweeks,2024-08-26 16:49:55,False,HgEOJGbH,49,True,75,True,False,Federal late year sign. 🎯,http://schultz.info/,-0.3,negative,positive
lisa66,2024-08-03 08:29:05,False,SHNbcGcT,34,False,57,True,True,Individual policy ball defense.,https://key-white.com/,0.0,neutral,neutral
adambrooks,2024-09-29 11:27:43,True,mQIvQJDl,10,False,14,True,True,Admit little budget see.,https://www.clark-mclaughlin.com/,-0.1875,negative,neutral
ljimenez,2024-10-29 01:23:07,True,zqgOjRuO,16,False,51,False,True,Bit animal early night one agree.,http://www.ford.net/,0.1,positive,neutral
ljohnson,2024-09-24 18:33:40,False,ZasGMTBR,0,False,16,False,False,Enough son exist collection surface accept want.,https://bridges.com/,0.0,neutral,neutral
thomas67,2024-06-05 14:35:44,False,zUHlfiFN,12,True,98,True,True,Page firm education open help bring.,https://www.burton.com/,-0.1,negative,neutral
adrienne61,2024-11-07 16:54:53,True,AdWPvcpd,34,True,72,False,True,Statement green hundred remain ball item ask.,http://boyd.com/,-0.2,negative,neutral
kaufmanlisa,2024-09-11 11:22:31,False,xKShjAFj,41,True,49,False,False,South theory project leader cup realize member.,https://goodwin-lee.com/,0.0,neutral,neutral
jmccall,2024-09-27 05:21:02,True,TWYOWueA,24,True,27,False,False,Participant everybody age hand young compare pick.,https://www.sullivan-rios.com/,0.1,positive,neutral
